{
  "fileId": "4_h4a48fe8875c6214145260818",
  "fileName": "photos/image.jpg",
  "accountId": "abc123def456",
  "bucketId": "e73ede9969c64355ef8b",
  "contentLength": 102400,
  "contentSha1": "a1b2c3d4e5f6a1b2c3d4e5f6a1b2c3d4e5f6a1b2",
  "contentType": "image/jpeg",
  "fileInfo": {},
  "action": "upload",
  "uploadTimestamp": 1660000000000
}